{"codex_versions":["0.144.4"],"limit_policy_version":"1.0","manifest_scripts_field":"accepted_no_execution_observed","minimum_reader_version":"0.2.0","platforms":["linux-x86_64","macos-arm64","windows-x86_64"],"policy_version":"1.0","record_digest":"baee6d012e944cc742c1404157e8bfc7f9ea564467a5435335374b5cf64676e7","schema_digest":"5c23d5106aeb96c00fd132193d3d0a52b055158486d443af01aba6df5a2a96c1","schema_version":"1.0","writer_version":"0.2.0"}
